{"kind":"LowFiPrototypeCurrent","layer":"Current","explorationArtifactRef":"artifact:low_fi_prototype_001_exploration","sourceJourneyRef":"artifact:user_journey_001_current#journey_map","sourceFlowRef":"artifact:flow_model_001_current#flow_model","lowFiDesignLanguage":{"purpose":"用最少视觉承诺验证交互逻辑。","principles":["interaction_first","content_realism","data_slots_before_data_layer","one_page_one_file","replayable_routes","accessible_semantics","disposable_code"]},"pageSet":{"pageSetId":"guided_issue_intake_html_pages","startPageId":"help_entry","testQuestion":"客户能否带着足够证据提交并追踪支持问题？","fidelity":{"visual":"纯低保真 HTML。","interaction":"相对链接可走通主路径和一个恢复路径。","content":"代表性标签和占位用户输入。"},"pages":[{"pageId":"help_entry","title":"帮助入口","route":"help-entry.html","htmlFile":"demo-pages/guided-issue-intake/help-entry.html","purpose":"选择自助解决、提交新问题或追踪已有问题。","sourceFlowNodes":["帮助入口"],"requiredElements":["search","suggested_help","start_issue","track_existing"],"contentSlots":["issue.searchQuery","knownIncidents"],"defaultParams":{"category":"vpn"},"interactionNotes":["开始提交进入 evidence-request.html。"]},{"pageId":"evidence_request","title":"证据收集","route":"evidence-request.html","htmlFile":"demo-pages/guided-issue-intake/evidence-request.html","purpose":"提交前收集问题事实和证据。","sourceFlowNodes":["描述问题","附加证据"],"requiredElements":["category","description","impact","evidence_checklist","continue"],"contentSlots":["issue.category","issue.description","issue.impact","evidence.items"],"defaultParams":{"category":"vpn","ticket":"SUP-1042"},"interactionNotes":["上传用复选框和文件名文字模拟。"]},{"pageId":"submit_review","title":"提交确认","route":"submit-review.html","htmlFile":"demo-pages/guided-issue-intake/submit-review.html","purpose":"最终提交前评审工单摘要。","sourceFlowNodes":["提交问题"],"requiredElements":["summary","evidence_status","edit","submit"],"contentSlots":["issue.summary","issue.impact","evidence.status"],"defaultParams":{"ticket":"SUP-1042","evidence":"screenshot"},"interactionNotes":["提交后进入 tracking-status.html，并显示模拟工单号。"]},{"pageId":"tracking_status","title":"状态追踪","route":"tracking-status.html","htmlFile":"demo-pages/guided-issue-intake/tracking-status.html","purpose":"展示工单状态、下一步、负责人和时间线。","sourceFlowNodes":["追踪状态"],"requiredElements":["ticket_id","state","next_action","timeline","add_evidence"],"contentSlots":["ticket.id","status.state","status.nextAction","status.timeline"],"defaultParams":{"ticket":"SUP-1042","state":"in_triage"},"interactionNotes":["补充证据会回到 evidence-request.html，覆盖等待客户路径。"]}],"routeMap":[{"fromPageId":"help_entry","toPageId":"evidence_request","trigger":"开始提交问题","queryParams":{"category":"vpn"},"sourceFlowEdgeRef":"flow:Find help->Describe issue"},{"fromPageId":"help_entry","toPageId":"tracking_status","trigger":"追踪已有工单","queryParams":{"ticket":"SUP-1042","state":"in_triage"}},{"fromPageId":"evidence_request","toPageId":"submit_review","trigger":"继续确认","queryParams":{"ticket":"SUP-1042","evidence":"screenshot"},"sourceFlowEdgeRef":"flow:Attach evidence->Submit issue"},{"fromPageId":"submit_review","toPageId":"tracking_status","trigger":"提交问题","queryParams":{"ticket":"SUP-1042","state":"in_triage"},"sourceFlowEdgeRef":"flow:Submit issue->Track status"},{"fromPageId":"tracking_status","toPageId":"evidence_request","trigger":"补充被要求的证据","guard":"waiting_for_customer","queryParams":{"ticket":"SUP-1042","returnTo":"tracking_status"}}],"smokePath":["help_entry","evidence_request","submit_review","tracking_status"],"contentData":{"defaultDatasetId":"demo_support_issue","dataFiles":[{"datasetId":"demo_support_issue","format":"yaml","file":"demo-data/support-issue-demo.yaml","purpose":"供 HTML 页面使用的问题、证据和状态 demo 内容。"}],"routeParamSchema":{"lang":"zh|en","data":"dataset id","page":"page id selected by current renderer","ticket":"support ticket id","category":"issue category","state":"ticket state"},"bindingRules":[{"slot":"ticket.id","source":"query.ticket || dataset.ticket.id"},{"slot":"issue.category","source":"query.category || dataset.issue.category"},{"slot":"status.state","source":"query.state || dataset.status.state"}]},"tokenBudget":{"pages":4,"maxHtmlTokensPerPage":900,"estimatedTotalHtmlTokens":2700},"runtimeNotes":["Renderer 用 iframe 预览每个页面；页面链接在框内运行。"],"openQuestions":["哪些问题分类在缺少证据时应阻止提交？"],"downstreamHandoff":["该流程确认后，UI Spec 再细化组件。","Interaction Contract 应把 route map 触发器转成事件契约。"]},"decisionTrace":{"selectedOptionId":"guided_issue_intake_pages","reviewer":"human_reviewer","reviewedAt":"2026-05-16T00:00:00Z","rationale":"选择原因是它用小而可维护的页面走通完整旅程。","rejectedOptions":["status_first_pages","agent_assisted_pages"],"userEdits":["要求每个页面一个独立 HTML 文件。"]},"openRisks":["该原型不验证真实文件上传。"],"assumptions":["登录态和工单号生成均为模拟。"],"evidenceRefs":["artifact_block:user_journey_001_current#journey_map","artifact_block:flow_model_001_current#flow_model"]}
